mysql> INSERT INTO sse.student VALUES(192125999,"GUGAN","M","2002-11-14",98901310,"CHENNAI");
Query OK, 1 row affected (1.26 sec)

mysql> SELECT * FROM sse.student;
+-----------+-------+--------+------------+----------+---------+
| RegNo     | Name  | Gender | DOB        | MobileNo | City    |
+-----------+-------+--------+------------+----------+---------+
| 191711342 | Raju  | M      | 2002-11-14 | 77319232 | chirala |
| 192125999 | GUGAN | M      | 2002-11-14 | 98901310 | CHENNAI |
+-----------+-------+--------+------------+----------+---------+
2 rows in set (0.00 sec)


mysql> UPDATE sse.student set Name = "Kiran" where RegNo = 191711342;
Query OK, 1 row affected (0.16 sec)
Rows matched: 1  Changed: 1  Warnings: 0

mysql> SELECT * FROM student;
+-----------+-------+--------+------------+----------+---------+
| RegNo     | Name  | Gender | DOB        | MobileNo | City    |
+-----------+-------+--------+------------+----------+---------+
| 191711342 | Kiran | M      | 2002-11-14 | 77319232 | chirala |
| 192125999 | Kiran | M      | 2002-11-14 | 98901310 | CHENNAI |
+-----------+-------+--------+------------+----------+---------+
2 rows in set (0.00 sec)


mysql> SELECT * FROM faculty;
+-------+---------+--------+------------+------------+------------+
| FacNo | FacName | Gender | DOB        | DOJ        | MobileNo   |
+-------+---------+--------+------------+------------+------------+
| CA13  | PALANI  | M      | 1990-10-02 | 2018-08-27 | 1976667893 |
| CA12  | SELVAM  | M      | 1999-02-01 | 2020-01-01 |  773102106 |
+-------+---------+--------+------------+------------+------------+
2 rows in set (0.00 sec)

mysql> DELETE FROM sse.faculty WHERE FacName = "SELVAM";
Query OK, 1 row affected (0.15 sec)

mysql> SELECT * FROM faculty;
+-------+---------+--------+------------+------------+------------+
| FacNo | FacName | Gender | DOB        | DOJ        | MobileNo   |
+-------+---------+--------+------------+------------+------------+
| CA13  | PALANI  | M      | 1990-10-02 | 2018-08-27 | 1976667893 |
+-------+---------+--------+------------+------------+------------+
1 row in set (0.00 sec)


